{"$schema":"http://json-schema.org/draft-07/schema#","title":"RoundwoodPile","description":"Roundwood Pile","type":"object","required":["location","logs"],"properties":{"location":{"$ref":"https://schema.vinv.io/location/en/0.0.2-beta.json"},"logs":{"title":"Logs","description":"Multiple logs definition.","type":"array","minItems":1,"items":{"$ref":"https://schema.vinv.io/log/en/0.0.2-beta.json"}},"image_pile_front":{"title":"Image","description":"Image of the Pile front","$ref":"https://schema.vinv.io/image/en/0.0.2-beta.json"},"treeNumber":{"title":"Unique number","description":"Number/ID of the tree","type":"string","maxLength":26,"examples":["#1","45","ASDF435gHDFGhsgj5646"]}},"$id":"https://schema.vinv.io/vinv-roundwood-pile/en/0.0.2-beta.json"}